<?xml version="1.0" encoding="UTF-8"?>
<!--

 OpenRemote, the Home of the Digital Home.
 Copyright 2008-2012, OpenRemote Inc.

 See the contributors.txt file in the distribution for a
 full listing of individual contributors.

 This is free software; you can redistribute it and/or modify it
 under the terms of the GNU General Public License as
 published by the Free Software Foundation; either version 3.0 of
 the License, or (at your option) any later version.

 This software is distributed in the hope that it will be useful,
 but WITHOUT ANY WARRANTY; without even the implied warranty of
 MERCHANTABILITY or FITNESS FOR A PARTICULAR PURPOSE.

 You should have received a copy of the GNU General Public
 License along with this software; if not, write to the Free
 Software Foundation, Inc., 51 Franklin St, Fifth Floor, Boston, MA
 02110-1301 USA, or see the FSF site: http://www.fsf.org.

-->

<!--
  UDP Transport protocol (send-only).

  Author: Richard Turner
-->
<openremote xmlns = "http://www.openremote.org" 
            xmlns:xsi = "http://www.w3.org/2001/XMLSchema-instance"
	    xsi:schemaLocation = "http://www.openremote.org protocol.xsd">

  <protocol displayName = "UDP" tagName = "udp">

    <attr name = "ipAddress" label = "IP Address">
      <validations>
        <allowBlank>false</allowBlank>
          <regex message="Must be a valid IPv4 or IPv6 address or a fully qualified domain name">(?:(?:1\d{0,2}|[3-9]\d?|2(?:[0-5]{1,2}|\d)?|0)\.){3}(?:1\d{0,2}|[3-9]\d?|2(?:[0-5]{1,2}|\d)?|0)|(^(([a-zA-Z]|[a-zA-Z][a-zA-Z0-9\-]*[a-zA-Z0-9])\.)*([A-Za-z]|[A-Za-z][A-Za-z0-9\-]*[A-Za-z0-9])$)|(^([0-9a-f]{1,4}:){1,1}(:[0-9a-f]{1,4}){1,6}$)|(^([0-9a-f]{1,4}:){1,2}(:[0-9a-f]{1,4}){1,5}$)|(^([0-9a-f]{1,4}:){1,3}(:[0-9a-f]{1,4}){1,4}$)|(^([0-9a-f]{1,4}:){1,4}(:[0-9a-f]{1,4}){1,3}$)|(^([0-9a-f]{1,4}:){1,5}(:[0-9a-f]{1,4}){1,2}$)|(^([0-9a-f]{1,4}:){1,6}(:[0-9a-f]{1,4}){1,1}$)|(^(([0-9a-f]{1,4}:){1,7}|:):$)|(^:(:[0-9a-f]{1,4}){1,7}$)|(^((([0-9a-f]{1,4}:){6})(25[0-5]|2[0-4]\d|[0-1]?\d?\d)(\.(25[0-5]|2[0-4]\d|[0-1]?\d?\d)){3})$)|(^(([0-9a-f]{1,4}:){5}[0-9a-f]{1,4}:(25[0-5]|2[0-4]\d|[0-1]?\d?\d)(\.(25[0-5]|2[0-4]\d|[0-1]?\d?\d)){3})$)|(^([0-9a-f]{1,4}:){5}:[0-9a-f]{1,4}:(25[0-5]|2[0-4]\d|[0-1]?\d?\d)(\.(25[0-5]|2[0-4]\d|[0-1]?\d?\d)){3}$)|(^([0-9a-f]{1,4}:){1,1}(:[0-9a-f]{1,4}){1,4}:(25[0-5]|2[0-4]\d|[0-1]?\d?\d)(\.(25[0-5]|2[0-4]\d|[0-1]?\d?\d)){3}$)|(^([0-9a-f]{1,4}:){1,2}(:[0-9a-f]{1,4}){1,3}:(25[0-5]|2[0-4]\d|[0-1]?\d?\d)(\.(25[0-5]|2[0-4]\d|[0-1]?\d?\d)){3}$)|(^([0-9a-f]{1,4}:){1,3}(:[0-9a-f]{1,4}){1,2}:(25[0-5]|2[0-4]\d|[0-1]?\d?\d)(\.(25[0-5]|2[0-4]\d|[0-1]?\d?\d)){3}$)|(^([0-9a-f]{1,4}:){1,4}(:[0-9a-f]{1,4}){1,1}:(25[0-5]|2[0-4]\d|[0-1]?\d?\d)(\.(25[0-5]|2[0-4]\d|[0-1]?\d?\d)){3}$)|(^(([0-9a-f]{1,4}:){1,5}|:):(25[0-5]|2[0-4]\d|[0-1]?\d?\d)(\.(25[0-5]|2[0-4]\d|[0-1]?\d?\d)){3}$)|(^:(:[0-9a-f]{1,4}){1,5}:(25[0-5]|2[0-4]\d|[0-1]?\d?\d)(\.(25[0-5]|2[0-4]\d|[0-1]?\d?\d)){3}$)</regex>
      </validations>
    </attr>

    <attr name = "port" label = "Port">
      <validations>
        <allowBlank>false</allowBlank>
        <maxLength>5</maxLength>
        <regex message = "Port must be an integer number.">\d+</regex>
      </validations>
    </attr>

    <attr name = "command" label = "Command">
      <validations>
        <allowBlank>false</allowBlank>
        <maxLength>4000</maxLength>
        <regex message = "Command is necessary">.*\w+.*</regex>
      </validations>
    </attr>

  </protocol>
</openremote>

