<?xml version="1.0" encoding="UTF-8"?>
<openremote xmlns="http://www.openremote.org" xmlns:xsi="http://www.w3.org/2001/XMLSchema-instance"
	xsi:schemaLocation="http://www.openremote.org protocol.xsd">
	<protocol displayName="X10" tagName="x10">
		<attr name="address" label="Address">
			<validations>
				<allowBlank>false</allowBlank>
			</validations>
		</attr>
		<attr name="command" label="Command">
			<validations>
				<allowBlank>false</allowBlank>
				<maxLength>10</maxLength>
				<regex message="Command is necessary">.*\w+.*</regex>
			</validations>
		</attr>
	</protocol>
</openremote>