<?xml version="1.0" encoding="UTF-8"?>
<openremote xmlns="http://www.openremote.org" 
            xmlns:xsi="http://www.w3.org/2001/XMLSchema-instance"
            xsi:schemaLocation="http://www.openremote.org protocol.xsd">
  <protocol displayName="panStamp lagarto" tagName="lagarto">
    <attr name="network" label="Server name">
      <validations>
        <allowBlank>false</allowBlank>
      </validations>
    </attr>
    <attr name="epid" label="Endpoint ID">
      <validations>
        <allowBlank>false</allowBlank>
      </validations>
    </attr>
    <attr name="value" label="New value">
      <validations>
        <allowBlank>true</allowBlank>
      </validations>
    </attr>
  </protocol>
</openremote>
