<?xml version="1.0" encoding="UTF-8"?>

<!--
 
 OpenRemote, the Home of the Digital Home.
 Copyright 2008-2012, OpenRemote Inc.
 
 See the contributors.txt file in the distribution for a
 full listing of individual contributors.
 
 This is free software; you can redistribute it and/or modify it
 under the terms of the GNU General Public License as
 published by the Free Software Foundation; either version 3.0 of
 the License, or (at your option) any later version.
 
 This software is distributed in the hope that it will be useful,
 but WITHOUT ANY WARRANTY; without even the implied warranty of
 MERCHANTABILITY or FITNESS FOR A PARTICULAR PURPOSE.
 
 You should have received a copy of the GNU General Public
 License along with this software; if not, write to the Free
 Software Foundation, Inc., 51 Franklin St, Fifth Floor, Boston, MA
 02110-1301 USA, or see the FSF site: http://www.fsf.org.
 
 -->

<!--
 |  ShellExe protocol configuration for OpenRemote Designer.
 |
 |  Author: Marcus Redeker
 +-->
<openremote xmlns="http://www.openremote.org"
    xmlns:xsi="http://www.w3.org/2001/XMLSchema-instance"
    xsi:schemaLocation="http://www.openremote.org protocol.xsd">
    
    <protocol displayName="Shell execution protocol" tagName="shellexe">
        
        <attr name="commandPath" label="Path" tooltipMessage="Full path to executable">
            <validations>
                <allowBlank>false</allowBlank>
            </validations>
        </attr>
        
        <attr name="commandParams" label="Command parameter" tooltipMessage="Additional parameter added to the command">
            <validations>
                <allowBlank>true</allowBlank>
            </validations>
        </attr>
        
        <attr name="pollingInterval" label="Polling interval" tooltipMessage="Polling interval in form of (1s, 1m, 1h) or just milliseconds">
            <validations>
                <allowBlank>true</allowBlank>
            </validations>
        </attr>
        
        <attr name="regex" label="RegularExpression" tooltipMessage="RegularExpression to parse value out of result" >
            <validations>
                <allowBlank>true</allowBlank>
            </validations>
        </attr>
        
        <attr name="sensorNamesList" label="Sensor names" tooltipMessage="Semicolon seperated list of sensor names. Uses the regex to split result on multiple sensors" >
            <validations>
                <allowBlank>true</allowBlank>
            </validations>
        </attr>
        
    </protocol>
</openremote>
