<?xml version="1.0" encoding="UTF-8"?>
<!--

 OpenRemote, the Home of the Digital Home.
 Copyright 2008-2012, OpenRemote Inc.

 See the contributors.txt file in the distribution for a
 full listing of individual contributors.

 This is free software; you can redistribute it and/or modify it
 under the terms of the GNU General Public License as
 published by the Free Software Foundation; either version 3.0 of
 the License, or (at your option) any later version.

 This software is distributed in the hope that it will be useful,
 but WITHOUT ANY WARRANTY; without even the implied warranty of
 MERCHANTABILITY or FITNESS FOR A PARTICULAR PURPOSE.

 You should have received a copy of the GNU General Public
 License along with this software; if not, write to the Free
 Software Foundation, Inc., 51 Franklin St, Fifth Floor, Boston, MA
 02110-1301 USA, or see the FSF site: http://www.fsf.org.

-->

<!--
  DSC IT-100 Security System Protocol.

  Uses IP-based protocol and requires IP-to-Serial interface to integrate
  with DSC IT-100 security system.

  Author: Greg Rapp
-->
<openremote xmlns="http://www.openremote.org" 
            xmlns:xsi="http://www.w3.org/2001/XMLSchema-instance"
            xsi:schemaLocation="http://www.openremote.org protocol.xsd">

  <protocol displayName="DSC IT-100" tagName="dscit100">

    <attr name="address" label="IT-100 Address">
      <validations>
        <allowBlank>false</allowBlank>
      </validations>
    </attr>

    <attr name="command" label="Command">
      <validations>
        <allowBlank>false</allowBlank>
      </validations>
    </attr>

    <attr name="target" label="Target">
      <validations>
        <allowBlank>false</allowBlank>
    	<maxLength>3</maxLength>
        <regex message="Only numbers allowed">[0-9]{1,3}</regex>      
      </validations>
    </attr>

    <attr name="code" label="Security Code">
      <validations>
        <allowBlank>true</allowBlank>
      </validations>
    </attr>

  </protocol>
</openremote>

