<?xml version="1.0" encoding="UTF-8"?>

<!--

 OpenRemote, the Home of the Digital Home.
 Copyright 2008-2012, OpenRemote Inc.

 See the contributors.txt file in the distribution for a
 full listing of individual contributors.

 This is free software; you can redistribute it and/or modify it
 under the terms of the GNU General Public License as
 published by the Free Software Foundation; either version 3.0 of
 the License, or (at your option) any later version.

 This software is distributed in the hope that it will be useful,
 but WITHOUT ANY WARRANTY; without even the implied warranty of
 MERCHANTABILITY or FITNESS FOR A PARTICULAR PURPOSE.

 You should have received a copy of the GNU General Public
 License along with this software; if not, write to the Free
 Software Foundation, Inc., 51 Franklin St, Fifth Floor, Boston, MA
 02110-1301 USA, or see the FSF site: http://www.fsf.org.

-->

<!--
 |  Lutron Homeworks protocol configuration for OpenRemote Designer.
 |
 |  Author: Eric Bariaux
 +-->
<openremote xmlns="http://www.openremote.org" xmlns:xsi="http://www.w3.org/2001/XMLSchema-instance"
	xsi:schemaLocation="http://www.openremote.org protocol.xsd">
	<protocol displayName="Lutron HomeWorks" tagName="lutron_homeworks">
		<attr name="address" label="Address">
			<validations>
				<allowBlank>false</allowBlank>
				<!-- message is option -->
				<!-- <regex message="Address should be ">(\d\.){3}\d</regex> -->
			</validations>
		</attr>
		<attr name="command" label="Lutron Command">
			<validations>
				<allowBlank>false</allowBlank>
				<maxLength>16</maxLength>
				<regex message="Command must be one of RAISE, LOWER, STOP, FADE, STATUS_DIMMER, SCENE, STATUS_SCENE, PRESS, RELEASE, HOLD, DOUBLE_TAP, STATUS_KEYPADLED.">RAISE|LOWER|STOP|FADE|STATUS_DIMMER|SCENE|STATUS_SCENE|PRESS|RELEASE|HOLD|DOUBLE_TAP|STATUS_KEYPADLED</regex>
			</validations>
		</attr>
		<attr name="scene" label="Scene to select">
			<validations>
				<allowBlank>true</allowBlank>
				<maxLength>2</maxLength>
				<regex message="Numbers only">\d+</regex>
			</validations>
		</attr>
		<attr name="key" label="Key to act on">
			<validations>
				<allowBlank>true</allowBlank>
				<maxLength>2</maxLength>
				<regex message="Number only">\d+</regex>
			</validations>
		</attr>
		<attr name="level" label="Level to dim to">
			<validations>
				<allowBlank>true</allowBlank>
				<maxLength>3</maxLength>
				<regex message="Number only, 0-100 range">\d+</regex>
			</validations>
		</attr>
	</protocol>
</openremote>
